[
  {
    "BorrowerId": 900333,
    "LoanId": 100333,
    "BorrowerOrdinal": 1,
    "BorrowerFirstName": "Riley",
    "BorrowerLastName": "Cooper",
    "BorrowerMiddleName": "",
    "BorrowerUnparsedName": "Riley Cooper",
    "BorrowerMailingLocality": "Synthetic City",
    "BorrowerMailingRegion": "FL",
    "BorrowerMailingPostalCode": "00000",
    "BorrowerEmailAddress": "riley.cooper@example.test",
    "BorrowerPrimaryPhoneNumber": "5550100",
    "ObligorFlag": true
  }
]
